{
  "$schema": "https://json-schema.org/draft/2020-12/schema",
  "$id": "https://serialos.local/schemas/creator-profile.schema.json",
  "title": "CreatorProfileSuggestion",
  "type": "object",
  "additionalProperties": false,
  "required": [
    "displayName",
    "positioning",
    "domains",
    "goals",
    "audiences",
    "voice",
    "boundaries",
    "confidence",
    "evidence"
  ],
  "properties": {
    "displayName": {
      "type": "string",
      "minLength": 1,
      "maxLength": 50
    },
    "positioning": {
      "type": "string",
      "minLength": 10,
      "maxLength": 300
    },
    "domains": {
      "type": "array",
      "minItems": 1,
      "maxItems": 8,
      "items": {
        "type": "string",
        "minLength": 1,
        "maxLength": 50
      },
      "uniqueItems": true
    },
    "goals": {
      "type": "array",
      "maxItems": 8,
      "items": {
        "enum": [
          "influence",
          "lead_generation",
          "recruiting",
          "community",
          "documentation",
          "teaching",
          "other"
        ]
      },
      "uniqueItems": true
    },
    "audiences": {
      "type": "array",
      "minItems": 1,
      "maxItems": 5,
      "items": {
        "type": "object",
        "additionalProperties": false,
        "required": [
          "name",
          "situation",
          "pains",
          "desiredOutcomes",
          "knowledgeLevel"
        ],
        "properties": {
          "id": {
            "type": [
              "string",
              "null"
            ]
          },
          "name": {
            "type": "string",
            "minLength": 1,
            "maxLength": 80
          },
          "situation": {
            "type": "string",
            "maxLength": 500
          },
          "pains": {
            "type": "array",
            "maxItems": 10,
            "items": {
              "type": "string",
              "minLength": 1,
              "maxLength": 200
            }
          },
          "desiredOutcomes": {
            "type": "array",
            "maxItems": 10,
            "items": {
              "type": "string",
              "minLength": 1,
              "maxLength": 200
            }
          },
          "knowledgeLevel": {
            "enum": [
              "beginner",
              "intermediate",
              "advanced",
              "mixed"
            ]
          },
          "avoidTerms": {
            "type": "array",
            "maxItems": 30,
            "items": {
              "type": "string",
              "maxLength": 80
            }
          }
        }
      }
    },
    "voice": {
      "type": "object",
      "additionalProperties": false,
      "required": [
        "traits",
        "sentenceStyle",
        "narrativePatterns",
        "preferredPhrases",
        "bannedPhrases",
        "evidenceStyle"
      ],
      "properties": {
        "traits": {
          "type": "array",
          "maxItems": 8,
          "items": {
            "type": "string",
            "minLength": 1,
            "maxLength": 50
          },
          "uniqueItems": true
        },
        "sentenceStyle": {
          "type": "string",
          "maxLength": 500
        },
        "narrativePatterns": {
          "type": "array",
          "maxItems": 10,
          "items": {
            "type": "string",
            "maxLength": 200
          }
        },
        "preferredPhrases": {
          "type": "array",
          "maxItems": 50,
          "items": {
            "type": "string",
            "maxLength": 100
          }
        },
        "bannedPhrases": {
          "type": "array",
          "maxItems": 100,
          "items": {
            "type": "string",
            "maxLength": 100
          }
        },
        "evidenceStyle": {
          "type": "string",
          "maxLength": 500
        }
      }
    },
    "boundaries": {
      "type": "object",
      "additionalProperties": false,
      "required": [
        "privateTopics",
        "redactionRules",
        "prohibitedClaims"
      ],
      "properties": {
        "privateTopics": {
          "type": "array",
          "maxItems": 50,
          "items": {
            "type": "string",
            "maxLength": 150
          }
        },
        "redactionRules": {
          "type": "array",
          "maxItems": 100,
          "items": {
            "type": "string",
            "maxLength": 300
          }
        },
        "prohibitedClaims": {
          "type": "array",
          "maxItems": 100,
          "items": {
            "type": "string",
            "maxLength": 300
          }
        }
      }
    },
    "confidence": {
      "type": "number",
      "minimum": 0,
      "maximum": 1
    },
    "evidence": {
      "type": "array",
      "maxItems": 100,
      "items": {
        "type": "object",
        "additionalProperties": false,
        "required": [
          "fieldPath",
          "sourceId",
          "reason"
        ],
        "properties": {
          "fieldPath": {
            "type": "string",
            "minLength": 1,
            "maxLength": 200
          },
          "sourceId": {
            "type": "string",
            "minLength": 1,
            "maxLength": 100
          },
          "reason": {
            "type": "string",
            "minLength": 1,
            "maxLength": 500
          }
        }
      }
    }
  }
}
